{
  "schema": "actionable-export-v1",
  "bundle_id": "disk-steward-invalid-false-complete",
  "generated_at": "2026-09-13T05:00:00Z",
  "consistent_view_id": "sqlite-read-003",
  "scope": {
    "volume_capacity_scope": "whole-volume-capacity",
    "file_detail_roots": ["/Users/example/Documents/Codex"],
    "exclusions": [],
    "detail_coverage": "complete",
    "state_as_of": "2026-09-13T04:55:00Z",
    "last_complete_generation_at": null,
    "active_generation": {
      "generation_id": "generation-still-running",
      "completed_slices": 1,
      "staged_objects": 100000,
      "has_more": true
    },
    "open_gap_count": 1
  },
  "files": [
    {"path": "codex-brief.md", "role": "codex-brief", "sha256": "aaaaaaaaaaaaaaaaaaaaaaaaaaaaaaaaaaaaaaaaaaaaaaaaaaaaaaaaaaaaaaaa", "bytes": 512},
    {"path": "summary.json", "role": "summary", "sha256": "bbbbbbbbbbbbbbbbbbbbbbbbbbbbbbbbbbbbbbbbbbbbbbbbbbbbbbbbbbbbbbbb", "bytes": 256},
    {"path": "rollups.json", "role": "summary", "sha256": "cccccccccccccccccccccccccccccccccccccccccccccccccccccccccccccccc", "bytes": 256},
    {"path": "events.jsonl.zlib", "role": "events", "sha256": "dddddddddddddddddddddddddddddddddddddddddddddddddddddddddddddddd", "bytes": 128},
    {"path": "snapshots.json", "role": "snapshot", "sha256": "eeeeeeeeeeeeeeeeeeeeeeeeeeeeeeeeeeeeeeeeeeeeeeeeeeeeeeeeeeeeeeee", "bytes": 128},
    {"path": "current-state.json", "role": "current-state", "sha256": "ffffffffffffffffffffffffffffffffffffffffffffffffffffffffffffffff", "bytes": 1024},
    {"path": "provenance.json", "role": "provenance", "sha256": "1111111111111111111111111111111111111111111111111111111111111111", "bytes": 64},
    {"path": "sessions.json", "role": "agent-sessions", "sha256": "2222222222222222222222222222222222222222222222222222222222222222", "bytes": 64},
    {"path": "coverage.json", "role": "coverage", "sha256": "3333333333333333333333333333333333333333333333333333333333333333", "bytes": 128},
    {"path": "lifecycle.json", "role": "lifecycle", "sha256": "4444444444444444444444444444444444444444444444444444444444444444", "bytes": 128},
    {"path": "integrity.json", "role": "integrity", "sha256": "5555555555555555555555555555555555555555555555555555555555555555", "bytes": 512}
  ],
  "brief": {
    "sections": ["evidence-age", "scope", "coverage", "largest-current-consumers", "growth", "cleanup-review-leads", "provenance", "lifecycle", "limitations"],
    "growth_assessment": "measured-no-change",
    "inspection_order": ["manifest.json", "coverage.json"]
  },
  "limitations": [],
  "privacy": {
    "contains_file_contents": false,
    "contains_environment": false,
    "path_detail": "full",
    "redaction_applied": true
  }
}
